IMN000224,wedding,recipient,girl,,,girl,,,,,,,,,wedding,114321,571877.0,770080.0,0.0,0.0,0.0,41,22,4,12.56,declining,0,girls wedding guest dress | zombie bride costume for girls | corpse bride costume girls | baby girl wedding guest dress | girls wedding guest dresses | toddler girl wedding guest dress | girls wedding shoes | bride costume for girls | baby wedding outfit girl | girls wedding guest dresses size 10 12
IMN000225,unknown,interest,coffee,theme,vintage,,,,coffee,vintage,,mug,,,,149092,307979.25,800575.0,0.0,0.0,0.0,26,10,4,12.53,growing,0,vintage coffee mug | vintage coffee table | vintage coffee maker | vintage coffee cups | vintage glass coffee mug | vintage espresso cups | 4pcs set vintage coffee mug | vintage coffee grinder | coffee table vintage | vintage coffee pot
IMN000226,unknown,recipient,boy,theme,patriotic,boy,,,,patriotic,,,,,,161030,270810.0,413680.0,0.0,0.0,0.0,5,3,3,12.43,declining,0,captain america costume kids boys | boys captain america costume | captain america toys for boys 4 6
IMN000227,decor,interest,camping,,,,,,camping,,,,,halloween,halloween,134159,435256.0,718592.0,0.0,0.0,0.0,49,20,4,12.36,declining,0,camper decor | camping decor | camping party decorations | camper decor for inside | rv decorations for inside camper | camping decorations | camping themed party decorations | halloween camping decorations | halloween camper decorations | camping halloween decorations
IMN000228,unknown,interest,gardening,theme,floral,,,,gardening,floral,,,,,,142617,393144.0,684346.0,0.0,0.0,0.0,33,13,4,12.28,growing,0,lego botanical garden | portmeirion botanical garden | botanical garden lego set | flower garden building toy | lego sets botanical garden | flower garden toy | flower garden seed bank | flower garden | cut flower garden book | lego botanical garden sets
IMN000229,matching,recipient,grandma,,,grandma,,,,,,,,,,166719,273647.5,380576.0,0.0,0.0,0.0,2,1,2,12.26,declining,1,grandma and me matching outfits
IMN000230,unknown,recipient,husband,theme,faith,husband,,,,faith,,,,,,171198,258950.25,417427.0,0.0,0.0,0.0,8,1,4,12.25,declining,0,mr church
IMN000231,unknown,pet,dog,interest,hunting,,,dog,hunting,,,,,,,152485,356094.0,640648.5,0.0,0.0,0.0,50,19,4,12.17,declining,0,dog hunting vest | dog the bounty hunter | dog hunting vest orange | hunting dog collar | dog the bounty hunter costume | hunting dog vest | hunting dog accessories | dog the bounty hunter wig | hunting dog toys | dog bounty hunter costume
IMN000232,unknown,recipient,girl,interest,gardening,girl,,,gardening,,,,,,,171130,285524.5,395790.0,0.0,0.0,0.0,7,3,4,12.08,growing,0,flower garden building toys for girls | beer garden girl costume | the girls in the garden
IMN000233,unknown,pet,dog,theme,floral,,,dog,,floral,,,,,,130759,556532.25,771178.0,0.0,0.0,0.0,32,11,4,12.04,declining,0,dog flower costume | forta floral for dogs | flower dog costume | floral dog collar | dog flower collar | flower dog collar | dog collar flowers | flower costume for dogs | dog collar flower | dog collar with flower
IMN000234,unknown,interest,coffee,theme,faith,,,,coffee,faith,,mug,,,,138051,544352.5,830879.0,0.0,0.0,0.0,35,17,4,11.85,growing,0,christian coffee mug | christian coffee mug for women | jesus coffee mug | christian coffee mug for men | scripture coffee cups with lids | religious coffee mug | christian coffee cups | coffee and jesus | bible verse coffee mug | jesus take the coffee
IMN000235,gift,profession,accountant,,,,accountant,,,,,,,,,138517,541702.5,794075.0,0.0,0.0,0.0,7,4,4,11.84,growing,0,accountant gift | accountant gift for women | accountant gift for men | cpa gift
IMN000236,unknown,pet,dog,interest,coffee,,,dog,coffee,,,mug,,,,146361,484135.0,814160.0,0.0,0.0,0.0,25,11,4,11.81,growing,0,coffee wood dog chew | dog coffee mug | dog coffee table book | coffee wood dog chew large | dog coffee costume | coffee dog toy | canophera coffee wood dog chew | coffee dog costume | dog coffee cup | resident dog coffee table book
IMN000237,matching,recipient,girl,theme,american,girl,,,,american,,,,,,156700,410367.0,620502.5,0.0,0.0,0.0,20,10,4,11.81,growing,0,american girl doll matching outfits | bow dream girl dress cartoon cute and matching american girl doll clothes | american girl doll matching pajamas | american girl matching outfits | american girl doll clothes matching sets | matching american girl doll outfits | american girl matching pajamas | american girl doll pajamas matching set | american girl doll matching clothes | american girl doll matching pjs
IMN000238,personalized,profession,truck driver,,,,truck driver,,,,,,,,,184186,281923.0,724089.0,0.0,0.0,0.0,9,3,4,11.79,declining,0,custom trucker hat | custom trucker hats for men | custom trucker hats
IMN000239,unknown,recipient,girl,interest,coffee,girl,,,coffee,,,mug,,,,169539,345150.0,860313.0,0.0,0.0,0.0,17,6,4,11.78,declining,0,beach city coffee surfer girl | gilmore girls coffee mug | golden girls coffee mug | gilmore girls coffee cup | skinny girl coffee syrup | girl dad coffee mug
IMN000240,unknown,pet,cat,interest,reading,,,cat,reading,,,,,,,189694,264208.5,461167.5,0.0,0.0,0.0,12,4,4,11.78,declining,0,cat eye reading glasses for women | cat eye reading glasses | reading glasses for women cat eye style | cat reading pillow
IMN000241,anniversary,recipient,grandma,,,grandma,,,,,,,,,anniversary,187132,274465.0,308571.0,0.0,0.0,0.0,4,2,3,11.77,declining,1,nana 25th anniversary edition | nana anniversary edition
IMN000242,christmas,interest,fishing,,,,,,fishing,,,ornament,,christmas,christmas,143811,525468.0,896529.0,0.0,0.0,0.0,21,11,3,11.74,growing,0,fishing ornament for christmas tree | fishing christmas ornament | fishing christmas wrapping paper | fishing wrapping paper christmas | fishing christmas calendar | fishing christmas stocking | fishing christmas sweater | christmas fishing advent calendar | fishing calendar christmas | christmas fishing wrapping paper
IMN000243,gift,profession,nurse,theme,funny,,nurse,,,funny,,,,,,150053,480047.25,861450.0,0.0,0.0,0.0,6,3,4,11.72,growing,0,funny nurse gift | nurse gag gift | nurse funny gift
IMN000244,christmas,interest,pickleball,,,,,,pickleball,,,ornament,,christmas,christmas,193072,261422.0,523009.0,0.0,0.0,0.0,12,7,3,11.72,growing,0,a pickleball christmas | pickleball ornament for christmas tree | pickleball christmas ornament | pickleball christmas | pickleball christmas shirt | christmas pickleball shirt | pickleball christmas sweater
IMN000245,unknown,recipient,mom,theme,floral,mom,,,,floral,,,,,,184335,308644.75,542782.5,0.0,0.0,0.0,14,9,3,11.63,declining,1,mum flowers | mum flowers for homecoming | homecoming mum flower | mum flower | fake mum flowers | homecoming mum flowers | mum balls artificial flowers | black mum flower | flowers for mom
IMN000246,unknown,recipient,grandpa,interest,coffee,grandpa,,,coffee,,,mug,,,,157660,489293.0,717275.0,0.0,0.0,0.0,6,5,2,11.48,growing,0,grandpa coffee mug | grandpa coffee cup | grandpa coffee tumbler | grandpa mug coffee | coffee mug for grandpa
IMN000247,unknown,recipient,girl,theme,boho,girl,,,,boho,,,,,,185519,333751.0,684207.5,0.0,0.0,0.0,6,2,4,11.46,declining,0,girls boho dress | boho girls dress
IMN000248,gift,recipient,mom,theme,faith,mom,,,,faith,,,,,,157352,504283.75,1027838.0,0.0,0.0,0.0,10,6,3,11.43,growing,0,christian gift for mom | christian mom gift | religious gift for mom | mom christian gift | gift for mom christian | gift for christian mom
IMN000249,unknown,recipient,girl,interest,yoga,girl,,,yoga,,,,,,,195515,314225.75,660708.0,0.0,0.0,0.0,26,8,4,11.35,growing,0,girls yoga pants | crz yoga girls | kids yoga mats ages 6 10 girls | girls yoga pants size 10 12 | yoga pants for girls | crz yoga girls leggings | girls yoga pants size 14 16 | girls yoga set
IMN000250,apparel,interest,reading,,,,,,reading,,,sweatshirt,,halloween,halloween,160403,517431.0,871093.5,0.0,0.0,0.0,30,14,4,11.3,growing,0,reading is my favorite sport sweatshirt | reading rainbow shirt | reading sweatshirt | reading is my favorite sport shirt | id rather be reading sweatshirt | reading shirt | reading rainbow shirt for women | reading shirt for teachers | ghost reading shirt | 67 reading shirt
IMN000251,apparel,recipient,cat mom,lifestyle,cat lover,cat mom,,,,,cat lover,shirt,,,,180134,393300.0,499655.0,0.0,0.0,0.0,9,4,4,11.3,growing,0,cat mom shirt | cat mom sweatshirt | cat mom hat | cat mom shirt for women
IMN000252,decor,interest,hunting,,,,,,hunting,,,poster,,,,180597,400852.0,834935.0,0.0,0.0,0.0,85,26,4,11.25,growing,0,hunting decor | kpop demon hunter poster | kpop demon hunter party decorations | hunter x hunter poster | kpop demon hunter decorations | no hunting signs | no hunting or trespassing signs | kpop demon hunter cake decorations | k pop demon hunter party decorations | k pop demon hunter poster
IMN000253,apparel,recipient,mom,theme,funny,mom,,,,funny,,shirt,,,,168788,474869.0,643227.0,0.0,0.0,0.0,11,5,4,11.24,growing,1,funny mom shirt | funny shirt for mom | mom shirt funny | funny mom shirt for women | funny mom sweatshirt
IMN000254,gift,interest,fishing,theme,funny,,,,fishing,funny,,,,,,153878,603480.0,830945.5,0.0,0.0,0.0,8,5,4,11.21,growing,0,funny fishing gift | fishing gag gift | funny fishing gift for men | fishing gag gift for men | fishing funny gift
IMN000255,unknown,recipient,boy,interest,hunting,boy,,,hunting,,,,,,,178339,429283.25,719348.5,0.0,0.0,0.0,42,20,4,11.19,growing,0,hunting toys for boys | soja boy costume demon hunter | boys hunting gear | boys hunting boots | hunting toys for boys age 4 7 | boys hunting | boys hunting toys | kpop demon hunter costume boys | hunting gear for boys | hunting stuff for boys
IMN000256,unknown,interest,camping,lifestyle,rv life,,,,camping,,rv life,,,,,177135,453826.0,806896.5,0.0,0.0,0.0,58,25,4,11.12,declining,0,short queen mattress for rv camper | sewer hose for rv camper | water pressure regulator for rv camper | rhino sewer hose for rv camper | rv camper accessories | black tank treatment for rv camper | water regulator for rv camper | queen short mattress for rv camper | black tank cleaner for rv camper | sewer hose support for rv camper
IMN000257,matching,profession,police officer,,,,police officer,,,,,,,,,192636,378107.25,546727.5,0.0,0.0,0.0,4,3,2,11.08,growing,0,cop and inmate couple costume | police and prisoner couple costume | prisoner and cop couple costume
IMN000258,decor,interest,fishing,,,,,,fishing,,,poster,,,,181337,440922.0,756376.0,0.0,0.0,0.0,51,20,4,11.07,stable,0,fishing net decor | fishing decor | fishing party decorations | clear fishing line for hanging decorations | fishing cake decorations | fishing themed party decorations | fishing line for hanging decor | gone fishing sign | gone fishing party decorations | fishing decorations for party
IMN000259,decor,profession,teacher,,,,teacher,,,,,,name,,,173365,496763.5,823823.0,0.0,0.0,0.0,23,9,4,11.05,declining,0,teacher desk decor | please sign and return stamp teacher | sign and return stamp teacher | teacher decor | teacher classroom decor | teacher door sign | teacher decorations for classroom | teacher name sign | teacher sign
IMN000260,apparel,recipient,husband,,,husband,,,,,,shirt,,,,182253,465419.75,738885.0,0.0,0.0,0.0,58,21,4,10.95,stable,1,sorry about my husband hat | trophy husband shirt | mr potato head shirt | emotional support husband shirt | mr incredible shirt | mr potato head hat | mr ducks shirt | husband and wife shirt | hubby and wifey shirt | mr krabs shirt
IMN000261,apparel,recipient,boy,interest,soccer,boy,,,soccer,,,shirt,,,,172338,537042.5,733716.5,0.0,0.0,0.0,32,13,4,10.94,growing,1,soccer shirt for boys | soccer clothes for boys | football shirt for boys | boys soccer shirt | football baby boy clothes | boys football shirt | soccer hoodie boys | boys soccer hoodie | soccer shirt boys | boys soccer sweatshirt
IMN000262,unknown,profession,chef,interest,camping,,chef,,camping,,,,,,,186908,440866.0,700420.5,0.0,0.0,0.0,12,3,4,10.94,growing,0,commercial chef saucepan camping cookware | gerber camping cook set | camping cook set
IMN000263,unknown,interest,soccer,theme,patriotic,,,,soccer,patriotic,,,,,,199799,379416.75,690350.0,0.0,0.0,0.0,26,15,4,10.92,growing,0,usa soccer jersey | america soccer | usa soccer jersey kids | usa soccer | usa world cup soccer jersey 2026 | usa soccer jersey men | america soccer merch | america soccer team | usa football game theme accessories | america jersey soccer
IMN000264,unknown,recipient,girl,interest,hunting,girl,,,hunting,,,blanket,,,,162292,636712.0,847386.0,0.0,0.0,0.0,41,20,4,10.89,declining,0,mira demon hunter costume girls | kpop demon hunter toys for girls | kpop demon hunter blanket for girls | kpop demon hunter pajamas girls | demon hunter toys for girls | k pop demon hunter blanket for girls | girls hunter boots | demon hunter dolls for girls | k pop demon hunter toys for girls | kpop demon hunter costume girls
IMN000265,matching,recipient,dad,,,dad,,,,,,shirt,photo,christmas,christmas,162833,630094.0,837142.0,0.0,0.0,0.0,73,36,4,10.89,growing,2,dad and son matching shirt | father son matching shirt | dad and baby matching outfits | daddy and me matching outfits | dad and son matching outfits | father and son matching shirt | father son matching outfits | daddy and me picture frame | dad and daughter matching outfits | dad and son matching flannel shirt
IMN000266,decor,recipient,mom,,,mom,,,,,,poster,,,,193750,437965.75,604096.5,0.0,0.0,0.0,8,4,4,10.8,declining,3,mama mia party decorations | mum decorations homecoming | homecoming mum decorations | how i met your mother poster
IMN000267,gift,recipient,grandpa,theme,funny,grandpa,,,,funny,,,,,,223423,312958.0,519081.0,0.0,0.0,0.0,4,2,2,10.79,growing,0,funny grandpa gift | funny gift for grandpa
IMN000268,unknown,interest,coffee,lifestyle,coffee lover,,,,coffee,,coffee lover,,,,,177514,551224.0,1029071.0,0.0,0.0,0.0,13,9,4,10.77,growing,0,coffee lover | coffee lovers | coffee accessories for coffee lovers | stocking stuffers for coffee lovers | coffee gadgets for coffee lovers | the little book for coffee lovers | coffee lover stocking stuffers | coffee items for coffee lovers | for coffee lovers
IMN000269,appreciation,recipient,wife,,,wife,,,,,,,,,,203185,397857.0,625230.0,0.0,0.0,0.0,9,4,4,10.77,declining,0,pastor wife appreciation gift | pastors wife appreciation gift | pastor and wife appreciation cards | pastor and wife appreciation gift
IMN000270,apparel,recipient,boy,interest,fishing,boy,,,fishing,,,shirt,,,,217450,340854.5,506284.0,0.0,0.0,0.0,15,6,4,10.75,growing,0,fishing shirt for boys | boys fishing shirt | boys fishing hoodie | huk fishing shirt for boys | kids fishing shirt boys | boys fishing hat
IMN000271,memorial,recipient,husband,,,husband,,,,,,,,,,231051,310450.5,360053.5,0.0,0.0,0.0,4,1,4,10.66,growing,1,memorial gift for loss of husband
IMN000272,wedding,interest,gardening,,,,,,gardening,,,,,,wedding,227165,326051.0,645652.0,0.0,0.0,0.0,9,4,3,10.65,declining,0,pretty garden wedding guest dresses | garden wedding guest dress | garden party wedding guest dress | garden formal dresses for wedding guest
IMN000273,wedding,recipient,boy,,,boy,,,,,,,,,wedding,217692,372526.5,456369.0,0.0,0.0,0.0,19,9,3,10.59,declining,2,toddler wedding outfit boy | baby wedding outfit boy | boys wedding guest outfit | baby boy wedding guest outfit | boys wedding outfit | baby boy wedding outfit | toddler boy wedding guest outfit | toddler boy wedding outfit | newborn wedding outfit boy
IMN000274,unknown,recipient,boy,theme,floral,boy,,,,floral,,,,,,223872,357707.0,623943.0,0.0,0.0,0.0,15,4,4,10.55,growing,0,flower boy vinyl | boys over flowers | flower boy | flower boy cd
IMN000275,christmas,interest,hunting,,,,,,hunting,,,ornament,,christmas,christmas,201289,475219.5,818808.0,0.0,0.0,0.0,22,15,3,10.5,growing,0,hunter green christmas ornament | hunting christmas ornament | hunting ornament for christmas tree | hunter green ornament for christmas tree | kpop demon hunter christmas ornament | hunter green christmas decor | hunting christmas wrapping paper | hunting christmas decorations | duck hunting christmas ornament | hunting christmas tree ornament
IMN000276,unknown,recipient,husband,interest,soccer,husband,,,soccer,,,,,,,177518,643352.5,750617.0,0.0,0.0,0.0,7,2,4,10.49,declining,0,mr football | mr beast football
IMN000277,gift,recipient,husband,theme,funny,husband,,,,funny,,,,,,205821,460749.0,569141.0,0.0,0.0,0.0,7,4,2,10.46,growing,0,funny gift for husband | funny husband gift | funny husband gift from wife | gag gift for husband
IMN000278,gift,recipient,girl,theme,faith,girl,,,,faith,,,,,,205186,480399.75,762090.0,0.0,0.0,0.0,18,7,4,10.4,growing,0,christian gift for teen girls | christian gift for girls | christian girl gift | christian teen girl gift | christian gift for teenage girls | teen girl christian gift | girls christian gift
IMN000279,unknown,recipient,girl,theme,faith,girl,,,,faith,,,,,,214255,431768.0,729409.0,0.0,0.0,0.0,58,24,4,10.4,declining,0,church dresses for girls | christian girl energy journal | girls church dresses | bible verse coloring book for girls | girls church shoes | church shoes for girls | christian hoodies for teen girls | the christian girl energy journal | church girl | bible verse jar for teen girls
IMN000280,matching,recipient,boy,,,boy,,,,,,,,christmas,christmas,184334,627882.75,1054420.0,0.0,0.0,0.0,30,11,4,10.38,stable,2,mommy and me hospital outfits baby boy | raven and beast boy couple costume | mom and baby boy matching outfits | boys matching sets | boys matching christmas pajamas | matching brothers outfits boys | mom and baby boy matching outfits hospital | boys matching outfits | mommy and me outfits baby boy | matching robe and swaddle set boy
IMN000281,apparel,recipient,boy,interest,hunting,boy,,,hunting,,,shirt,,,,210283,464830.0,937048.0,0.0,0.0,0.0,13,5,4,10.35,growing,0,boys hunting clothes | hunting clothes for boys | baby boy hunting clothes | hunting shirt for boys | boys hunting shirt
IMN000282,birthday,recipient,grandma,,,grandma,,,,,,,,,birthday,198597,537077.0,746233.0,0.0,0.0,0.0,25,7,4,10.34,declining,1,grandma birthday card | happy birthday grandma | birthday card for grandma | nana birthday card | grandma birthday | happy birthday grandma card | birthday card grandma
IMN000283,apparel,profession,teacher,theme,funny,,teacher,,,funny,,shirt,,,,230536,385494.75,653805.5,0.0,0.0,0.0,8,3,4,10.29,declining,0,funny teacher shirt | funny teacher shirt for women | funny math teacher shirt
IMN000284,apparel,recipient,grandpa,theme,funny,grandpa,,,,funny,,shirt,,,,200746,582248.0,921948.5,0.0,0.0,0.0,6,3,3,10.15,growing,0,funny grandpa shirt | funny shirt for grandpa | grandpa shirt for men funny
IMN000285,gift,recipient,girl,theme,american,girl,,,,american,,,,,,213425,517262.0,599189.0,0.0,0.0,0.0,9,3,4,10.1,growing,0,american girl gift card | american girl doll gift card | american pie presents girls' rules
IMN000286,gift,recipient,girl,interest,hunting,girl,,,hunting,,,,,,,230544,464105.5,573343.0,0.0,0.0,0.0,8,3,3,9.97,growing,0,demon hunter gift for girls | kpop demon hunter gift for girls | k pop demon hunter gift for girls
IMN000287,gift,recipient,grandma,theme,funny,grandma,,,,funny,,,,,,234457,468447.25,841921.5,0.0,0.0,0.0,8,5,2,9.88,growing,0,funny grandma gift | funny gift for grandma | granny panties gag gift | gag gift for grandma | giant granny panties gag gift
IMN000288,decor,recipient,boy,interest,soccer,boy,,,soccer,,,,,,,262422,366935.0,522524.0,0.0,0.0,0.0,30,10,4,9.83,growing,1,soccer room decor for boys | soccer posters for boys bedroom | football room decor for boys | soccer decor for boys room | football locker decorations for boys | football decor for boys room | football posters for boys bedroom | soccer bedroom decor for boys | football room decor for teen boys | football bedroom decor for boys
IMN000289,unknown,profession,teacher,interest,coffee,,teacher,,coffee,,,mug,,,,214853,611014.5,630094.0,0.0,0.0,0.0,7,4,2,9.78,growing,0,teacher coffee mug | teacher coffee cup | teacher coffee tumbler | coffee mug for teacher
IMN000290,unknown,pet,cat,theme,vintage,,,cat,,vintage,,,,halloween,halloween,237662,488952.0,663189.0,0.0,0.0,0.0,10,5,4,9.75,growing,0,cat clock with moving eyes and tail vintage | vintage cat magnets | vintage halloween cat | cat clock vintage | vintage cat clock
IMN000291,personalized,recipient,boy,,,boy,,,,,,blanket,,halloween,halloween,208422,680558.0,859188.0,0.0,0.0,0.0,49,23,4,9.72,growing,2,ninja custom for boys | boys custom halloween | personalized blanket for boys | personalized baby blanket for boys | boy custom halloween | custom baby blanket for boys | halloween custom for boys | halloween custom for toddler boys | personalized piggy bank for boys | baby boy custom halloween
IMN000292,decor,pet,cat,lifestyle,cat lover,,,cat,,,cat lover,,,,,259294,402800.5,472991.5,0.0,0.0,0.0,4,1,4,9.72,growing,0,cat decor for cat lovers
IMN000293,apparel,recipient,son,,,son,,,,,,shirt,,,,221926,589493.75,761859.5,0.0,0.0,0.0,18,7,4,9.71,growing,0,favorite son in law shirt | my son in law is my favorite child shirt | favorite son shirt | son of a nutcracker shirt | sanford and son shirt | son in law shirt | favorite son sweatshirt
IMN000294,unknown,interest,fishing,theme,funny,,,,fishing,funny,,,,,,221777,599061.5,988633.0,0.0,0.0,0.0,11,7,4,9.68,growing,0,funny fishing lures | fishing socks men funny | funny fishing socks | funny fishing | gag fishing lures | funny fishing lure | fishing funny
IMN000295,unknown,pet,dog,lifestyle,dog lover,,,dog,,,dog lover,mug,,,,229186,575888.75,1106768.5,0.0,0.0,0.0,12,9,2,9.61,growing,0,dog lover | dog lovers | dog mug for dog lovers | stocking stuffers for dog lovers | dog lover ornament | dog lover socks | dog lover pens | pawverbs for a dog lovers heart | dog lover mug
IMN000296,unknown,recipient,grandpa,theme,vintage,grandpa,,,,vintage,,,,,,292516,326183.5,351378.5,0.0,0.0,0.0,4,1,4,9.58,stable,0,grandpa sweaters vintage
IMN000297,unknown,recipient,girl,interest,gaming,girl,,,gaming,,,,,,,239369,536497.5,805443.0,0.0,0.0,0.0,42,18,4,9.55,growing,0,girls gaming chair | gamer girl | girl gaming chair | gaming chair for girls | gamer girl accessories | girl gaming headset | gaming chair girl | girls gaming headset | girl gaming accessories | gaming desk for girls
IMN000298,decor,interest,reading,,,,,,reading,,,,,,,265283,443917.5,711780.0,0.0,0.0,0.0,23,9,4,9.45,stable,0,reading nook decor | reading offic decor | reading corner decor for classroom | reading corner decor | reading posters for classroom | reading decor | reading room decor | the lost art of reading nature's signs | reading posters
IMN000299,gift,recipient,girl,interest,gaming,girl,,,gaming,,,,,,,235414,598384.0,648834.0,0.0,0.0,0.0,5,3,2,9.43,growing,0,gamer girl gift | gift for gamer girls | girl gamer gift
IMN000300,unknown,recipient,girl,interest,reading,girl,,,reading,,,,,,,266774,449606.0,598021.5,0.0,0.0,0.0,8,2,4,9.41,growing,0,level 1 reading books for girls | level 2 reading books for girls
IMN000301,matching,interest,camping,,,,,,camping,,,,,,,262364,506857.5,751351.0,0.0,0.0,0.0,3,2,2,9.26,growing,0,camping gift for couples | camper gift for couples
IMN000302,unknown,recipient,boy,interest,reading,boy,,,reading,,,,,,,289918,403817.5,556470.5,0.0,0.0,0.0,8,2,4,9.24,growing,0,level 1 reading books for boys | level 2 reading books for boys
IMN000303,appreciation,profession,truck driver,,,,truck driver,,,,,,,,,306866,360273.5,413681.0,0.0,0.0,0.0,2,2,1,9.2,stable,0,truck driver appreciation week gift | truck driver appreciation gift
IMN000304,christmas,recipient,grandma,,,grandma,,,,,,ornament,,christmas,christmas,258141,554367.0,1023515.0,0.0,0.0,0.0,27,19,2,9.18,growing,1,grandma christmas ornament | christmas for grandma | grandma christmas card | christmas card for grandma | grandma christmas | grandma christmas sweater | nana christmas ornament | christmas card grandma | grandma christmas shirt | grandma christmas sweatshirt
IMN000305,gift,recipient,boy,theme,funny,boy,,,,funny,,,,,,249381,603031.0,922240.0,0.0,0.0,0.0,11,9,2,9.17,growing,0,funny gift for teen boys | funny gift for boys | funny teen boy gift | gag gift for teen boys | gag gift for teenage boys | funny boy gift | funny gift for teen boy | gag gift for boys | funny gift for teenage boys
IMN000306,christmas,pet,cat,theme,funny,,,cat,,funny,,sweatshirt,,christmas,christmas,302809,385034.5,698957.5,0.0,0.0,0.0,4,3,2,9.14,growing,0,funny cat christmas cards | funny cat christmas sweater | funny cat christmas shirt
IMN000307,apparel,interest,camping,,,,,,camping,,,shirt,,,,250232,633250.0,890206.0,0.0,0.0,0.0,19,7,4,9.07,declining,0,camping clothes women | camping hat | camping clothes | camping shirt for women | womens camping clothes | camping shirt | camping shirt for men
IMN000308,gift,recipient,boy,interest,hunting,boy,,,hunting,,,,,,,272283,539546.0,844644.5,0.0,0.0,0.0,6,4,2,9.0,growing,0,hunting gift for boys | boys hunting gift | hunting gift for teen boys | demon hunter gift for boys
IMN000309,personalized,profession,police officer,,,,police officer,,,,,,,,,308855,412510.25,750280.0,0.0,0.0,0.0,4,4,1,8.94,stable,0,cop custom for women | police custom for women | police custom men | police custom kids boys
IMN000310,christmas,interest,reading,lifestyle,book lover,,,,reading,,book lover,ornament,,christmas,christmas,323846,386180.0,673752.0,0.0,0.0,0.0,5,2,3,8.85,growing,0,book lover christmas ornament | book lover ornament for christmas tree
IMN000311,memorial,recipient,son,,,son,,,,,,,,,,316382,410967.5,466342.5,0.0,0.0,0.0,4,1,4,8.84,growing,0,memorial gift for loss of son
IMN000312,apparel,profession,truck driver,theme,vintage,,truck driver,,,vintage,,,,,,300243,480169.0,568182.0,0.0,0.0,0.0,7,2,4,8.79,declining,0,vintage trucker hat | vintage trucker hats for men
