IMN000146,apparel,recipient,dad,lifestyle,cat lover,dad,,,,,cat lover,shirt,,,,44026,463230.0,487497.0,0.0,0.0,0.0,13,6,4,16.95,growing,0,cat dad shirt | cat dad club shirt | cat dad hat | cat dad shirt for men | best cat dad ever shirt | cat dad sweatshirt
IMN000147,gift,recipient,dad,lifestyle,dog lover,dad,,,,,dog lover,,,,,56121,262026.0,507886.0,0.0,0.0,0.0,11,4,4,16.93,growing,0,dog dad gift for men | dog dad gift | gift for dog dad | best dog dad gift
IMN000148,gift,profession,truck driver,,,,truck driver,,,,,,,,,59395,232577.0,549945.0,0.0,0.0,0.0,17,8,4,16.9,growing,0,truck driver gift | trucker gift | truck driver gift for men | trucker gift for men | tow truck driver gift | gift for truck driver | gift for a truck driver | trucker gift for truck driver
IMN000149,gift,pet,cat,theme,funny,,,cat,,funny,,,,,,50894,361523.0,543396.0,0.0,0.0,0.0,12,7,4,16.78,growing,0,funny cat gift | funny cat gift for women | cat gag gift | funny gift for cat lovers | cat funny gift | funny cat gift for men | funny cat lover gift
IMN000150,memorial,pet,cat,,,,,cat,,,,ornament,,,,66093,206499.75,387507.0,0.0,0.0,0.0,30,10,4,16.66,declining,0,cat memorial gift for loss of cat | cat memorial | cat memorial gift | pet memorial gift for cats | cat memorial stones | cat remembrance gift | cat memorial ornament | cat memorial stone | cat memorial frame | pet remembrance gift cat
IMN000151,apparel,recipient,girl,lifestyle,cowgirl,girl,,,,,cowgirl,shirt,,,,65930,209124.75,618954.5,0.0,0.0,0.0,32,13,4,16.65,declining,0,cowgirl hat for girls | girls cowgirl hat | cowgirl shirt for girls | cowgirl hats for girls | girls cowgirl shirt | cowgirl hat girls | pink cowgirl hat for girls | little girl cowgirl hat | girls pink cowgirl hat | girl cowgirl hat
IMN000152,wedding,recipient,girl,theme,floral,girl,,,,floral,,,,,wedding,56578,310842.0,952883.0,0.0,0.0,0.0,17,8,4,16.6,declining,0,flower girl dresses for wedding | flower girl shoes for wedding | fall flower girl dresses for wedding | flower girl robe for wedding day | flower girl headband for wedding | flower girl accessories for wedding | flower girl pajamas for wedding day | flower girls dresses for wedding
IMN000153,wedding,recipient,grandma,,,grandma,,,,,,,,,wedding,47110,490753.0,717756.0,0.0,0.0,0.0,42,17,4,16.57,declining,1,grandmother of the bride dresses | grandmother of the groom dresses | grandmother of the bride pant suits | grandmother of bride pant suits | dresses for grandmother of the bride | grandmother of bride dresses | grandmother of the bride dresses with jackets | grandma of the bride dress | grandmother of the bride dress | grandmother dresses for wedding
IMN000154,christmas,profession,nurse,,,,nurse,,,,,shirt,,christmas,christmas,59826,275295.5,680673.0,0.0,0.0,0.0,46,20,3,16.57,growing,0,nurse christmas shirt | nurse christmas sweatshirt | christmas nurse shirt | christmas nurse sweatshirt | nurse christmas ornament | christmas nurse badge reel | nurse christmas sweater | nurse ornament for christmas tree | christmas badge reel nurse | christmas nurse shirt for women
IMN000155,birthday,recipient,daughter,,,daughter,,,,,,,,,birthday,59616,281124.25,649190.5,0.0,0.0,0.0,58,17,4,16.55,declining,0,daughter birthday card | birthday card for daughter | daughter in law birthday card | birthday card daughter | birthday cards for daughter | birthday card for daughter in law | happy birthday daughter card | happy birthday daughter | birthday cards for daughter adult | birthday card daughter in law
IMN000156,christmas,recipient,dad,,,dad,,,,,,shirt,,christmas,christmas,47648,486057.75,812422.0,0.0,0.0,0.0,126,78,4,16.54,growing,2,letters from father christmas by j r r tolkien | christmas for dad | christmas scrub daddy | letters from father christmas | accidental christmas daddy | christmas card for dad | scrub daddy christmas | dad christmas | dad christmas card | father christmas
IMN000157,decor,recipient,boy,interest,gaming,boy,,,gaming,,,,,,,51678,400460.0,658351.0,0.0,0.0,0.0,33,12,4,16.53,growing,1,gamer room decor for boys | gaming decor for boys bedroom | gaming room decor for boys | boys gaming room decor | gaming posters for boys room | gamer decor for boys bedroom | boys gamer room decor | gaming signs for boys room | gamer bedroom decor for boys | gamer posters for boys room
IMN000158,unknown,pet,dog,interest,soccer,,,dog,soccer,,,,,,,59070,295001.0,762700.0,0.0,0.0,0.0,83,35,4,16.51,growing,0,dog soccer ball | dog football costume | dog football | dog soccer ball with straps | soccer ball for dogs | football dog toy | dog football jersey | dog soccer ball toy | dog football toy | football dog costume
IMN000159,decor,recipient,grandma,,,grandma,,,,,,poster,,,,51727,406866.0,571556.5,0.0,0.0,0.0,18,6,4,16.5,declining,1,coastal grandma decor | nana poster | grandma core decor | nana anime poster | grandma decor | grandma sign
IMN000160,christmas,profession,teacher,,,,teacher,,,,,shirt,,christmas,christmas,62233,266821.5,609428.0,0.0,0.0,0.0,51,26,3,16.46,growing,0,teacher christmas shirt | teacher christmas ornament | christmas teacher shirt | teacher christmas cards | teacher christmas sweatshirt | teacher christmas card | teacher ornament for christmas tree | christmas card for teacher | teacher christmas | teacher christmas sweater
IMN000161,matching,pet,dog,,,,,dog,,,,sweatshirt,,christmas,christmas,51277,429943.25,738982.0,0.0,0.0,0.0,130,67,4,16.44,growing,0,matching dog and owner clothes | dog and human matching costumes | matching dog and owner pajamas | matching pjs with dog | matching christmas pajamas with dog | dog and owner matching clothes | dog and owner matching pajamas | matching pajamas with dog | matching dog and owner halloween costumes | dog and human matching pajamas
IMN000162,birthday,interest,soccer,,,,,,soccer,,,,,,birthday,50897,456792.0,648735.0,0.0,0.0,0.0,61,20,4,16.37,declining,0,football birthday party decorations | soccer birthday party decorations | football birthday decorations | soccer birthday decorations | football birthday banner | soccer birthday party favors | football birthday | soccer birthday | football birthday party favors | happy birthday football banner
IMN000163,matching,recipient,girl,,,girl,,,,,,,,christmas,christmas,48024,538125.0,852460.0,0.0,0.0,0.0,99,42,4,16.32,declining,0,mommy and me hospital outfits baby girl | matching doll and girl clothes | girls matching sets | girl and doll matching outfits | girl and doll matching pajamas | matching doll and girl pajamas | matching girl and doll clothes | mommy and me outfits baby girl | doll and girl matching outfit | matching sister outfits girl and baby
IMN000164,decor,profession,chef,,,,chef,,,,,,,,,76578,180805.0,996065.0,0.0,0.0,0.0,9,4,4,16.27,declining,0,chili cook off decorations | fat chef kitchen decor | chef kitchen decor | chef decor for kitchen
IMN000165,apparel,pet,cat,theme,funny,,,cat,,funny,,shirt,,,,64730,275692.25,557167.0,0.0,0.0,0.0,20,4,4,16.24,growing,0,funny cat shirt | funny cat shirt for men | funny cat shirt for women | cat shirt funny
IMN000166,gift,recipient,girl,interest,soccer,girl,,,soccer,,,,,,,60592,335510.0,574199.0,0.0,0.0,0.0,21,9,4,16.17,growing,0,soccer gift for girls | girls soccer gift | soccer girl gift | soccer gift for girls 8 12 | girl soccer gift | soccer team gift for girls | gift for soccer players girls | soccer girls gift | soccer gift for teen girls
IMN000167,unknown,recipient,girl,theme,funny,girl,,,,funny,,,,halloween,halloween,79569,183027.75,733770.0,0.0,0.0,0.0,14,9,4,16.09,declining,0,funny girl | funny socks for girls | girls funny socks | funny socks for teen girls | funny costume for girls | funny girl socks | funny girls halloween costumes | funny halloween costumes for teen girls | funny slippers for girls
IMN000168,gift,profession,hairstylist,,,,hairstylist,,,,,,,christmas,christmas,66404,291803.5,608617.5,0.0,0.0,0.0,26,11,4,16.03,growing,0,hairdresser gift | gift for hairstylist women | hairstylist gift women | hairdresser gift for women | hairstylist gift | gift for hairdresser women | gift for hairdresser | gift for hairstylist | client gift in bulk hairstylist | cosmetologist gift
IMN000169,apparel,recipient,dog mom,lifestyle,dog lover,dog mom,,,,,dog lover,sweatshirt,,,,75186,216490.75,465700.0,0.0,0.0,0.0,22,7,4,16.03,growing,0,dog mom sweatshirt | dog mom shirt | dog mom hat | dog mom sweatshirt women | dog mom shirt for women | dog mom hoodie | dog mom hats for women
IMN000170,wedding,pet,dog,,,,,dog,,,,,,,wedding,59324,454493.5,646558.0,0.0,0.0,0.0,59,20,4,15.73,declining,0,silent groom pro for dogs | dog wedding outfit | dog wedding dress | zoom groom for dogs | kong zoom groom dog brush | groom pro dog brush | heusom silent groom pro for dogs 2025 | heisom silent groom pro for dogs | dog wedding bandana | dog wedding collar
IMN000171,gift,interest,reading,,,,,,reading,,,,,,,63497,388877.0,833975.5,0.0,0.0,0.0,18,7,4,15.72,growing,0,reading gift | reading gift for women | reading lovers gift | reading lovers gift ideas | reading gift for kids | reading gift for men | gift for reading lovers
IMN000172,unknown,profession,police officer,theme,patriotic,,police officer,,,patriotic,,,,,,108173,111270.5,131760.5,0.0,0.0,0.0,4,1,4,15.67,declining,0,team america world police
IMN000173,unknown,recipient,wife,theme,faith,wife,,,,faith,,,,,,110397,112861.5,121468.5,0.0,0.0,0.0,4,1,4,15.56,growing,0,the mad wife meagan church
IMN000174,christmas,recipient,daughter,,,daughter,,,,,,ornament,,christmas,christmas,78603,261767.0,547365.5,0.0,0.0,0.0,44,27,2,15.51,growing,0,christmas card for daughter | son and daughter in law christmas card | daughter christmas card | christmas card for son and daughter in law | christmas card daughter | christmas card son and daughter in law | christmas cards for son and daughter in law | christmas cards for daughter | daughter christmas ornament | christmas card for daughter and son in law
IMN000175,apparel,recipient,wife,,,wife,,,,,,sweatshirt,,,,69865,355931.0,557631.0,0.0,0.0,0.0,97,38,4,15.47,declining,0,wifey sweatshirt | let me ask my wife shirt | the man who mistook his wife for a hat | let me ask my wife hat | my wife is psychotic shirt | mrs potato head hat | mrs claus hat | wifey shirt | mr and mrs potato head shirt | my wife beats me shirt
IMN000176,unknown,recipient,dad,lifestyle,dog lover,dad,,,,,dog lover,mug,,,,68609,379751.5,511474.0,0.0,0.0,0.0,8,4,4,15.43,growing,0,dog dad | dog dad mug | dog dad socks | best dog dad
IMN000177,birthday,recipient,son,,,son,,,,,,,,,birthday,79273,282754.0,524218.0,0.0,0.0,0.0,51,14,4,15.34,declining,0,birthday card for son | son birthday card | son in law birthday card | birthday card son | birthday cards for son | happy birthday card for son | birthday card for son adult | happy birthday son | son birthday card from parents | happy birthday son card
IMN000178,gift,recipient,boy,interest,gaming,boy,,,gaming,,,,date,,,69216,393964.5,560858.5,0.0,0.0,0.0,26,15,4,15.33,growing,1,gamer gift for boys | gaming gift for teenage boys | teen boy gaming gift | gaming gift for boys | gamer gift for teen boys | gamer boy gift | gaming gift for boys 8 12 | gamer gift for boys 8 12 | boys gaming gift | gaming gift for teen boys
IMN000179,gift,profession,electrician,,,,electrician,,,,,,,,,81075,278207.75,694656.0,0.0,0.0,0.0,18,8,4,15.27,growing,1,electrician gift | electrician gift for men | lineman gift | lineman gift for men | gift for an electrician | gift for electrician | gift for lineman | gift for electrician man
IMN000180,decor,profession,realtor,,,,realtor,,,,,,,,,84786,253980.5,642115.0,0.0,0.0,0.0,15,5,4,15.25,declining,0,open house signs for real estate | real estate sign posts | real estate signs | for sale signs for real estate | real estate sign post
IMN000181,unknown,pet,cat,interest,coffee,,,cat,coffee,,,mug,,,,61128,613273.0,837142.0,0.0,0.0,0.0,29,13,4,15.08,growing,0,cat coffee mug | cat coffee cup | black cat coffee mug | cat coffee tumbler | jelly cat coffee | cat coffee mug for cat lovers | cat coffee table book | espresso martini cat scratcher | cat coffee | coffee mug cat
IMN000182,christmas,recipient,son,,,son,,,,,,ornament,,christmas,christmas,73428,392923.25,726689.5,0.0,0.0,0.0,24,18,2,15.08,growing,0,christmas card for son | son christmas card | christmas card son | christmas cards for son | son in law christmas card | christmas card for son and family | son christmas ornament | christmas card for son in law | christmas cards son | son and family christmas card
IMN000183,decor,recipient,son,,,son,,,,,,,,,,111114,153156.75,188218.0,0.0,0.0,0.0,4,1,4,14.99,declining,0,here comes the son baby shower decor
IMN000184,unknown,pet,cat,theme,funny,,,cat,,funny,,mug,,,,72648,445893.75,823512.0,0.0,0.0,0.0,66,38,4,14.91,growing,0,funny cat calendar 2026 | funny cat toys | funny cat socks | funny cat | funny cat calendar | funny cat stickers | funny cat hand towels | funny cat toy | funny cat costumes | cat toys funny
IMN000185,birthday,interest,hunting,,,,,,hunting,,,shirt,,,birthday,92802,261328.0,463778.0,0.0,0.0,0.0,33,13,4,14.81,declining,0,kpop demon hunter birthday decorations | k pop demon hunter birthday decorations | hunting birthday party decorations | kpop demon hunter birthday | demon hunter birthday decorations | k pop demon hunter birthday | kpop demon hunter birthday invitations | demon hunter birthday | hunting birthday decorations | hunting theme birthday decorations
IMN000186,memorial,recipient,mom,,,mom,,,,,,ornament,,,,64152,653429.5,839773.0,0.0,0.0,0.0,30,11,4,14.76,growing,3,memorial gift for loss of mom | bereavement gift for loss of mother | in memory of mom | mom memorial gift for loss of mother | mom memorial gift | remembrance gift for loss of mother | memorial gift for loss of mother | memorial wind chimes for loss of mother | mom memorial ornament | mother memorial gift
IMN000187,gift,interest,yoga,,,,,,yoga,,,,,,,78009,452911.0,531678.0,0.0,0.0,0.0,21,9,4,14.58,growing,0,yoga gift | yoga gift for women | gift for yoga lovers | yoga gift for women unique | yoga instructor gift | cool gift for yoga lovers | yoga gift for men | yoga lovers gift ideas | gift for yoga lovers women
IMN000188,gift,recipient,boy,interest,fishing,boy,,,fishing,,,,,,,95456,282333.5,413771.0,0.0,0.0,0.0,10,4,4,14.56,growing,0,fishing gift for boys | fishing gift for teen boys | boys fishing gift | fishing gift for boys 8 12
IMN000189,unknown,pet,cat,interest,fishing,,,cat,fishing,,,,,,,79710,438526.75,652898.5,0.0,0.0,0.0,30,11,4,14.55,growing,0,cat fishing pole toy | cat toy fishing pole | cat fishing pole | fishing pole cat toy | fishing rod cat toy | cat fishing rod | cat fishing gear | fishing pole cat toys for indoor cats | cat fishing toy | cat toy fishing rod
IMN000190,gift,recipient,mom,theme,funny,mom,,,,funny,,,,christmas,christmas,78682,469837.0,771840.0,0.0,0.0,0.0,21,11,4,14.48,growing,1,funny gift for mom | funny mom gift | gag gift for mom | mom gift funny | gift for mom funny | funny mother in law gift | funny christmas gift for mom | mom funny gift | funny gift for mother in law | mom gag gift
IMN000191,christmas,profession,truck driver,,,,truck driver,,,,,,,christmas,christmas,98820,274000.75,798450.5,0.0,0.0,0.0,6,3,3,14.47,growing,0,christmas trucker hat | christmas trucker hats | christmas trucker hats for women
IMN000192,birthday,interest,gaming,,,,,,gaming,,,,,,birthday,98867,283634.25,600964.0,0.0,0.0,0.0,18,5,4,14.4,declining,0,gamer birthday party decorations | gaming birthday party decorations | gamer birthday decorations | gamer birthday party favors | gaming birthday decorations
IMN000193,birthday,interest,fishing,,,,,,fishing,,,,,,birthday,96138,314240.5,604791.0,0.0,0.0,0.0,11,4,4,14.34,declining,0,fishing birthday party decorations | fishing birthday decorations | fishing birthday card | fishing birthday
IMN000194,unknown,recipient,dad,interest,coffee,dad,,,coffee,,,mug,,,,83087,461508.75,657588.0,0.0,0.0,0.0,24,16,4,14.28,growing,1,dad coffee mug | papa coffee mug | coffee mug for dad | dad coffee tumbler | dad coffee cup | coffee cup for dad | mom and dad coffee mug | best dad coffee mug | papa coffee cup | coffee mug dad
IMN000195,gift,profession,realtor,,,,realtor,,,,,,,,,100536,302492.0,540499.0,0.0,0.0,0.0,17,7,4,14.22,growing,0,realtor gift | real estate agent gift | realtor gift for women | gift for real estate agents | realtor gift for men | real estate gift | realtor gift for agent
IMN000196,birthday,interest,camping,,,,,,camping,,,,,,birthday,118005,215109.5,321258.5,0.0,0.0,0.0,10,4,4,14.14,declining,0,one happy camper birthday decorations | camping birthday party decorations | camping birthday | camping birthday decorations
IMN000197,personalized,pet,cat,,,,,cat,,,,ornament,name,christmas,christmas,95059,368370.25,717073.5,0.0,0.0,0.0,100,38,4,14.11,declining,0,cat tags personalized small | personalized cat collar | cat custom for women | cat name tags personalized | pet tags personalized cat | cat tags personalized | custom cat collar | custom cat pillow | personalized cat ornament | custom cat tag
IMN000198,unknown,recipient,mom,interest,coffee,mom,,,coffee,,,mug,,,,88213,452930.0,565160.0,0.0,0.0,0.0,20,11,4,14.06,growing,1,mom coffee mug | coffee mug for mom | mom coffee cup | coffee cup for mom | mama coffee mug | coffee mug mom | mom coffee tumbler | best mom coffee mug | coffee cups for mom | best mom ever coffee mug
IMN000199,unknown,recipient,boy,interest,gaming,boy,,,gaming,,,blanket,date,,,91354,416668.0,756345.0,0.0,0.0,0.0,97,49,4,14.06,growing,1,gaming accessories for teen boys | gaming rug for boys room | boys gaming chair | kids gaming chair 8 12 boys | gaming stuff for boys | gaming blanket for boys | gamer rug for boys room | gamer blanket for boys | gaming socks for boys | gamer accessories for boys
IMN000200,gift,profession,teacher,theme,funny,,teacher,,,funny,,,,,,79237,601410.0,746123.0,0.0,0.0,0.0,9,5,4,14.02,growing,0,funny teacher gift | teacher gift funny | teacher funny gift | teacher gag gift | funny teacher gift for co workers
IMN000201,unknown,recipient,boy,theme,funny,boy,,,,funny,,,,halloween,halloween,101855,429915.5,682914.5,0.0,0.0,0.0,32,24,4,13.55,growing,0,funny boy halloween costumes | funny socks for boys | funny toddler boy halloween costumes | boys funny socks | funny teen costumes for boys | funny costumes for boys 10 12 | funny boys halloween costumes | funny halloween costumes for boys | funny socks for teen boys | boys funny halloween costume
IMN000202,apparel,profession,truck driver,theme,funny,,truck driver,,,funny,,,,,,118999,296266.0,541404.0,0.0,0.0,0.0,21,6,4,13.54,growing,0,funny trucker hats | funny trucker hats for women | funny trucker hat | funny trucker hats for men | trucker hat funny | funny trucker hats for adult humor
IMN000203,unknown,pet,cat,theme,floral,,,cat,,floral,,,,,,91873,555215.75,833611.0,0.0,0.0,0.0,30,10,4,13.53,declining,0,flower cat tree | cat tails artificial flowers | cat tree flower | forta floral for cats | cat water fountain flower | cat flower pot | flower cat tower | elevated flower cat bed | flower cat bed | jelly cat flowers
IMN000204,unknown,recipient,grandma,interest,coffee,grandma,,,coffee,,,mug,,,,91862,558403.0,722134.0,0.0,0.0,0.0,21,15,4,13.52,growing,1,grandma coffee mug | nana coffee mug | grandma coffee cup | coffee mug for grandma | grandma mug coffee | grammy coffee mug | nana coffee cup | grandma coffee tumbler | grandma coffee cake | great grandma coffee mug
IMN000205,memorial,recipient,dad,,,dad,,,,,,ornament,,,,97879,478771.75,670720.5,0.0,0.0,0.0,20,8,4,13.52,growing,2,memorial gift for loss of dad | bereavement gift for loss of father | dad memorial gift | in memory of dad | dad memorial ornament | dad memorial gift for loss of father | memorial wind chimes for loss of father | memorial ornament dad
IMN000206,unknown,profession,hairstylist,,,,hairstylist,,,,,ornament,,,,105231,406889.0,760619.0,0.0,0.0,0.0,94,28,4,13.51,stable,0,hairstylist essentials | hairstylist aprons for women | hairstylist apron | apron for hairstylist | hairdresser ornament | hairstylist travel bag | capes for hairstylist | hairdresser apron | color bowls for hairstylist | hairstylist ornament
IMN000207,apparel,interest,gaming,,,,,,gaming,,,shirt,,,,121989,316382.0,677515.0,0.0,0.0,0.0,41,13,4,13.32,growing,0,gaming apparel | gaming hats | gamer shirt | gamer shirt for men | gamer hoodie | gaming shirt for men | gaming shirt | gaming hoodie | gamer hoodie for men | gamer sweatshirt
IMN000208,unknown,interest,coffee,theme,retro,,,,coffee,retro,,mug,,,,132378,262185.0,487497.0,0.0,0.0,0.0,15,6,4,13.31,declining,0,retro coffee maker | retro coffee table | retro engine coffee mug | retro coffee mug | retro espresso machine | coffee maker retro
IMN000209,unknown,pet,dog,theme,minimalist,,,dog,,minimalist,,,,halloween,halloween,117488,355402.75,626737.0,0.0,0.0,0.0,18,7,4,13.28,declining,0,simple green outdoor odor eliminator for dogs | simple human dog food storage | simple food project dog food | simple solutions dog diapers female | dog training made simple book | simple dog costume | simple dog halloween costumes
IMN000210,unknown,pet,dog,interest,camping,,,dog,camping,,,,,,,114225,393998.0,692450.0,0.0,0.0,0.0,45,15,4,13.22,declining,0,dog camping essentials | dog fence for rv camping | dog camping | camping dog bed | hot dog sticks for campfire | dog camping bed | camping dog fence | portable dog fence for rv camping | dog camping gear | dog camping chair
IMN000211,matching,interest,hunting,,,,,,hunting,,,,,,,138615,247273.0,355931.0,0.0,0.0,0.0,3,2,2,13.22,growing,0,deer and hunter costume couple | hunter and deer couple costume
IMN000212,unknown,recipient,girl,theme,minimalist,girl,,,,minimalist,,,,,,153837,193580.5,643161.5,0.0,0.0,0.0,12,3,4,13.21,stable,0,simple joys by carters baby girl | simple girl salad dressing | simple joys by carters toddler girls
IMN000213,unknown,profession,realtor,,,,realtor,,,,,ornament,,,,110927,426859.75,733234.5,0.0,0.0,0.0,100,35,4,13.2,growing,0,the power broker | real estate agent supplies | real estate | real estate books | realtor lock box | the power broker by robert caro | realtor supplies | power broker | realtor | the millionaire real estate agent
IMN000214,unknown,recipient,boy,theme,minimalist,boy,,,,minimalist,,,,halloween,halloween,156865,191573.0,587927.0,0.0,0.0,0.0,9,3,4,13.15,stable,0,simple joys by carter's baby boy | simple joys by carters toddler boys | simple halloween costumes for boys
IMN000215,unknown,interest,soccer,theme,american,,,,soccer,american,,,,,,128881,314685.0,822249.5,0.0,0.0,0.0,24,10,4,13.1,declining,0,american football cleats | american football | american football cleats men | american football vinyl | american football cd | american football gloves | youth american football cleats | american football iq | mens american football cleats | american football iq flashcards
IMN000216,personalized,recipient,girl,,,girl,,,,,,blanket,name,halloween,halloween,104794,572936.0,752194.0,0.0,0.0,0.0,109,57,4,12.92,growing,0,personalized blanket for girls | halloween custom for girls | cat custom for girls | personalized necklaces for girls | personalized baby blanket for girls | personalized jewelry box for girls | custom necklace for girls | boo custom monster inc toddler girl | personalized dance bag for girls | girl custom halloween
IMN000217,christmas,interest,soccer,,,,,,soccer,,,ornament,,christmas,christmas,129665,344822.0,728616.0,0.0,0.0,0.0,53,24,4,12.92,growing,0,football christmas ornament | soccer christmas ornament | soccer ornament for christmas tree | football ornament for christmas tree | football christmas wrapping paper | football christmas tree | soccer christmas wrapping paper | soccer ball with pump deflated operation christmas child | football christmas tree topper | soccer ball ornament for christmas tree
IMN000218,apparel,interest,pickleball,,,,,,pickleball,,,shirt,,halloween,halloween,133348,328407.5,583188.0,0.0,0.0,0.0,63,20,4,12.88,growing,0,pickleball shirt for men | pickleball shirt | pickleball shirt women | pickleball hat | pickleball clothes for women | pickleball shirt for women | pickleball hats for men | pickleball sweatshirt | mens pickleball shirt | womens pickleball clothing
IMN000219,unknown,interest,coffee,theme,boho,,,,coffee,boho,,mug,,,,117009,484667.0,902726.0,0.0,0.0,0.0,15,4,4,12.75,declining,0,boho coffee table | coffee table boho | boho coffee tables for living room | boho coffee mug
IMN000220,apparel,interest,fishing,theme,funny,,,,fishing,funny,,shirt,,,,124153,421838.25,609504.0,0.0,0.0,0.0,12,4,4,12.74,growing,0,funny fishing shirt for men | funny fishing shirt | funny fishing hat | fishing shirt funny
IMN000221,gift,recipient,girl,lifestyle,country girl,girl,,,,,country girl,,,,,147111,288665.0,709644.0,0.0,0.0,0.0,5,2,4,12.7,growing,0,country girl gift | country girl gift for women
IMN000222,unknown,pet,cat,lifestyle,cat lover,,,cat,,,cat lover,mug,,,,114374,550870.0,788941.0,0.0,0.0,0.0,49,29,4,12.62,growing,0,cat lover | cat mug for cat lovers | cat lovers | cat stuff for cat lovers | cat calendars for cat lovers 2026 | cat blanket for cat lovers | cat things for cat lovers | cat tumbler for cat lovers | stocking stuffers for cat lovers | cat items for cat lovers
IMN000223,unknown,profession,nurse,theme,funny,,nurse,,,funny,,,,,,144355,323605.5,492804.0,0.0,0.0,0.0,23,10,4,12.57,growing,0,funny nurse badge reel | funny nurse pens | nurse pens funny | nurse badge reel funny | funny nurse stickers | funny nurse socks | nurse socks funny | funny nurse badge reels | nurse stickers funny | funny nurse pen set
