IMN000313,christmas,profession,electrician,,,,electrician,,,,,ornament,,christmas,christmas,299235,498724.0,722374.0,0.0,0.0,0.0,5,2,3,8.74,growing,1,lineman christmas ornament | electrician christmas ornament
IMN000314,matching,recipient,husband,,,husband,,,,,,,,christmas,christmas,297995,524235.5,734341.0,0.0,0.0,0.0,15,8,4,8.67,growing,1,husband and wife matching pajamas | wife and husband matching pjs | husband and wife matching outfits | husband and wife matching christmas pajamas | husband and wife christmas pajamas matching sets | husband wife matching pajamas | matching husband and wife pajamas | husband and wife gift for couples set
IMN000315,gift,recipient,wife,theme,funny,wife,,,,funny,,,,,,284821,604148.75,905565.0,0.0,0.0,0.0,6,3,2,8.61,growing,0,funny gift for wife | funny wife gift | gag gift for wife
IMN000316,apparel,recipient,dad,lifestyle,dog lover,dad,,,,,dog lover,shirt,,,,290993,583658.0,974055.0,0.0,0.0,0.0,8,4,4,8.58,growing,0,dog dad shirt | dog dad hat | dog dad shirt for men | dog dad sweatshirt
IMN000317,apparel,recipient,girl,theme,vintage,girl,,,,vintage,,,,,,339229,404932.0,485496.0,0.0,0.0,0.0,9,3,4,8.58,declining,0,vintage baby clothes girl | vintage baby girl clothes | vintage toddler girl clothes
IMN000318,unknown,recipient,boy,theme,retro,boy,,,,retro,,,,,,248810,885878.0,1047425.0,0.0,0.0,0.0,10,7,3,8.51,growing,0,retro game boy | lego super mario game boy retro building set | lego super mario game boy retro building sets for adults ages 18 collectible model with game p | kids 70s outfits for boys | boys 70s outfit | game boy retro | retro game boy handheld
IMN000319,unknown,interest,gardening,theme,funny,,,,gardening,funny,,,,,,306926,545883.25,750868.0,0.0,0.0,0.0,14,8,4,8.47,growing,0,funny garden gnomes | funny garden flag | funny zen garden | funny garden gnome | garden gnomes outdoor funny | garden gnome funny | funny garden statues | funny zen garden for desk
IMN000320,memorial,interest,gardening,,,,,,gardening,,,,,,,338421,431373.0,690977.0,0.0,0.0,0.0,5,2,4,8.47,declining,0,memorial garden stones | memorial garden stone
IMN000321,apparel,interest,hunting,theme,funny,,,,hunting,funny,,shirt,,,,309598,563341.0,902282.0,0.0,0.0,0.0,5,2,3,8.38,growing,0,funny hunting shirt for men | funny hunting shirt
IMN000322,unknown,recipient,boy,interest,fishing,boy,,,fishing,,,blanket,,,,301612,608454.0,795635.0,0.0,0.0,0.0,31,16,4,8.36,declining,0,kids fishing poles for boys age 5 10 | boys fishing gear | fishing stuff for boys | fishing gear for boys | boys fishing pole | kids fishing poles for boys age 3 5 | fishing stuff for boys 8 12 | boys fishing | fishing gear for teenage boys | boys fishing vest
IMN000323,unknown,recipient,boy,theme,american,boy,,,,american,,,,,,305527,590120.0,646905.0,0.0,0.0,0.0,13,4,4,8.35,declining,0,all american boys | american boy | american boy doll | all american boys book
IMN000324,apparel,interest,gardening,,,,,,gardening,,,sweatshirt,,,,335510,480567.5,655185.0,0.0,0.0,0.0,39,16,4,8.32,stable,0,gardening hat | pretty garden clothing | pretty garden sweatshirt | over the garden wall shirt | garden gnome hat | gardening hat for women | grow a garden shirt | pretty garden hoodie | garden hat | teapot hat over the garden wall
IMN000325,wedding,recipient,husband,,,husband,,,,,,,,,anniversary,340961,462089.5,583588.0,0.0,0.0,0.0,7,2,4,8.32,declining,1,wedding anniversary card for husband | to my husband on our wedding day card
IMN000326,unknown,recipient,girl,lifestyle,country girl,girl,,,,,country girl,,,,,347757,442462.0,714748.0,0.0,0.0,0.0,13,4,4,8.31,declining,0,country girl | country girl outfits for women | country girl stuff | country girl shake it for me
IMN000327,unknown,pet,dog,lifestyle,cowgirl,,,dog,,,cowgirl,,,,,362898,408955.5,455013.0,0.0,0.0,0.0,3,2,2,8.27,growing,0,dog cowgirl costume | cowgirl dog costume
IMN000328,unknown,recipient,dad,interest,soccer,dad,,,soccer,,,,,,,328804,550832.5,691664.5,0.0,0.0,0.0,4,2,3,8.17,declining,0,on sundays we watch football with daddy | soccer dad
IMN000329,decor,profession,nurse,,,,nurse,,,,,,,,,299174,707405.5,818039.0,0.0,0.0,0.0,14,5,4,8.12,declining,0,school nurse office decor | nurse office decor | nurse party decorations | nurse decor | nurse cake decorations
IMN000330,unknown,profession,chef,theme,funny,,chef,,,funny,,,,,,322794,630654.25,715891.5,0.0,0.0,0.0,8,6,2,8.01,growing,0,funny chef apron | funny chef apron for men | funny cook books | funny cook book | chef apron funny | funny cook books for adults
IMN000331,unknown,recipient,boy,theme,faith,boy,,,,faith,,,,,,334528,584054.5,828707.0,0.0,0.0,0.0,24,10,4,7.99,declining,0,baby boy church outfit | boys church shoes | christian hoodies for boys | church shoes for boys | christian books for teen boys | toddler boy church shoes | bible verse jar for teen boys | toddler boy church outfit | bible verse coloring book for boys | boys christian bracelet
IMN000332,christmas,interest,reading,,,,,,reading,,,,,christmas,christmas,386270,417199.25,448128.5,0.0,0.0,0.0,2,1,2,7.98,declining,0,christmas reading glasses
IMN000333,apparel,recipient,boy,theme,vintage,boy,,,,vintage,,,,,,390687,423939.0,438410.5,0.0,0.0,0.0,4,1,4,7.9,growing,0,vintage baby boy clothes
IMN000334,matching,interest,gaming,,,,,,gaming,,,,,,,389274,445158.25,579076.0,0.0,0.0,0.0,6,2,4,7.83,growing,0,sex gaming cards for married couples | couples gaming desk
IMN000335,birthday,recipient,grandpa,,,grandpa,,,,,,,,,birthday,351863,571670.25,900833.5,0.0,0.0,0.0,8,3,4,7.81,declining,0,grandpa birthday card | happy birthday grandpa | birthday card for grandpa
IMN000336,apparel,recipient,girl,theme,floral,girl,,,,floral,,shirt,,,,377189,493424.75,665765.5,0.0,0.0,0.0,4,1,4,7.78,declining,0,flower girl shirt
IMN000337,personalized,recipient,grandma,,,grandma,,,,,,sweatshirt,,,,335510,669004.0,988150.0,0.0,0.0,0.0,17,11,3,7.74,growing,1,custom grandma sweatshirt | personalized grandma sweatshirt | grandma sweatshirt personalized | personalized blanket for grandma | custom grandma shirt | personalized snowman grandma | personalized grandma shirt | custom blanket for grandma | grandma blanket personalized | personalized grandma blanket
IMN000338,unknown,interest,gaming,theme,vintage,,,,gaming,vintage,,,,,,394853,461366.25,527879.5,0.0,0.0,0.0,2,1,2,7.71,growing,0,vintage video games
IMN000339,sympathy,pet,dog,,,,,dog,,,,,,,,357999,584855.0,694021.0,0.0,0.0,0.0,17,5,4,7.7,declining,0,dog sympathy card | pet sympathy cards for dogs | loss of dog sympathy card | sympathy card for loss of dog | sympathy card for loss of pet dog
IMN000340,christmas,profession,hairstylist,,,,hairstylist,,,,,ornament,,christmas,christmas,343685,652512.0,1068414.0,0.0,0.0,0.0,11,7,3,7.68,growing,0,hairdresser christmas ornament | hairstylist christmas ornament | hairstylist ornament christmas | hairdresser christmas card | hairdresser christmas ornament 2025 | christmas card for hairdresser | hairdresser ornament for christmas tree
IMN000341,christmas,interest,yoga,,,,,,yoga,,,ornament,,christmas,christmas,382441,530917.0,662283.0,0.0,0.0,0.0,9,6,2,7.59,growing,0,christmas yoga pants for women | christmas yoga pants | yoga christmas ornament | yoga ornament christmas | yoga ornament for christmas tree | yogi bear christmas
IMN000342,christmas,interest,gaming,,,,,,gaming,,,ornament,,christmas,christmas,394725,502627.5,602158.0,0.0,0.0,0.0,15,9,2,7.56,declining,0,gamer christmas ornament | gaming ornament for christmas tree | gamer ornament for christmas tree | gaming christmas ornament | gaming christmas wrapping paper | gamer christmas wrapping paper | gamer christmas sweater | gamer christmas stocking | gaming wrapping paper christmas
IMN000343,apparel,interest,soccer,theme,vintage,,,,soccer,vintage,,sweatshirt,,,,358970,669232.5,979495.0,0.0,0.0,0.0,3,2,2,7.45,declining,0,vintage football sweatshirt | vintage football shirt
IMN000344,gift,recipient,girl,lifestyle,cat lover,girl,,,,,cat lover,,,,,422251,481276.0,540301.0,0.0,0.0,0.0,2,1,2,7.35,growing,0,cat lover gift for girls
IMN000345,graduation,profession,nurse,,,,nurse,,,,,,,,graduation,390687,581397.0,677185.0,0.0,0.0,0.0,13,5,4,7.34,growing,0,nurse graduation party decorations | nurse graduation card | new grad nurse essentials | rn graduation party decorations | nurse graduation decorations
IMN000346,unknown,interest,coffee,lifestyle,book lover,,,,coffee,,book lover,mug,,,,364760,692753.0,816214.0,0.0,0.0,0.0,16,7,4,7.33,growing,0,book lover coffee mug | book lovers coffee mug | mind reader coffee organizer | book coffee mug for book lovers | coffee mug for book lovers | book lovers coffee cups | coffee mug book lover
IMN000347,christmas,profession,chef,,,,chef,,,,,ornament,,christmas,christmas,342904,816893.0,996065.0,0.0,0.0,0.0,5,3,2,7.3,declining,0,christmas cook book | chef christmas ornament | christmas chef hat
IMN000348,gift,recipient,dad,interest,fishing,dad,,,fishing,,,,,,,347109,803206.0,926826.0,0.0,0.0,0.0,7,6,2,7.27,growing,0,fishing gift for dad | dad fishing gift | gift for dad fishing | fishing gift dad | fishing dad gift | gift for fishing dad
IMN000349,unknown,interest,hunting,theme,faith,,,,hunting,faith,,,,,,415886,542177.25,590533.0,0.0,0.0,0.0,6,3,4,7.2,growing,0,faith hunter | jesus loves you more hunter beless | unpredictable magic faith hunter
IMN000350,gift,recipient,boy,theme,faith,boy,,,,faith,,,,,,426749,510073.5,678209.5,0.0,0.0,0.0,6,3,3,7.2,growing,0,christian gift for teen boys | christian gift for boys | boys christian gift
IMN000351,unknown,pet,cat,theme,retro,,,cat,,retro,,,,,,437465,502974.0,775548.0,0.0,0.0,0.0,12,5,4,7.12,stable,0,pete the cat and his four groovy buttons | jordan retro 4 black cat | jordan 4 retro black cat | pete the cat groovy buttons | air jordan 4 retro black cat
IMN000352,christmas,profession,firefighter,,,,firefighter,,,,,ornament,,christmas,christmas,365950,778456.5,1110348.5,0.0,0.0,0.0,10,5,3,7.11,growing,0,firefighter christmas ornament | fireman ornament for christmas tree | firefighter christmas decorations | fireman christmas ornament | firefighter ornament for christmas tree
IMN000353,unknown,interest,gardening,theme,patriotic,,,,gardening,patriotic,,,,,,375156,780427.5,1038958.5,0.0,0.0,0.0,4,1,4,7.0,declining,0,american flag garden flag
IMN000354,gift,pet,dog,theme,funny,,,dog,,funny,,,,,,387409,731809.5,1076210.0,0.0,0.0,0.0,3,2,2,6.97,growing,0,funny dog gift | funny hot dog gift
IMN000355,sympathy,recipient,mom,,,mom,,,,,,,,,,443762,538293.5,746389.0,0.0,0.0,0.0,11,4,4,6.94,declining,3,sympathy cards for loss of mother | sympathy card for loss of mother | loss of mother sympathy card | sympathy card loss of mother
IMN000356,gift,profession,teacher,theme,faith,,teacher,,,faith,,,,,,432820,578900.25,724980.5,0.0,0.0,0.0,2,1,2,6.92,growing,0,christian teacher gift
IMN000357,apparel,recipient,grandma,theme,funny,grandma,,,,funny,,shirt,,,,433868,582016.0,730164.0,0.0,0.0,0.0,3,1,2,6.9,growing,0,funny grandma shirt
IMN000358,anniversary,recipient,wife,theme,funny,wife,,,,funny,,,,,anniversary,470442,477762.5,485083.0,0.0,0.0,0.0,3,1,3,6.9,declining,0,funny anniversary cards for wife
IMN000359,unknown,pet,cat,interest,gaming,,,cat,gaming,,,,,,,414524,671160.5,927667.5,0.0,0.0,0.0,12,6,4,6.84,growing,0,cat gaming chair | cat ear gaming headset | gaming headset cat ears | cat gaming headset | cat gaming headphones | gaming chair cat
IMN000360,personalized,interest,gardening,,,,,,gardening,,,,,,,427164,629035.0,818678.0,0.0,0.0,0.0,17,7,4,6.83,declining,0,custom garden flag | personalized garden signs | custom garden sign | personalized garden flag | grandmas garden personalized | personalized garden sign | personalized garden stones
IMN000361,christmas,recipient,grandpa,,,grandpa,,,,,,ornament,,christmas,christmas,406735,713217.0,959990.0,0.0,0.0,0.0,7,5,3,6.81,growing,0,a grandpa for christmas | grandpa christmas card | christmas for grandpa | grandpa christmas ornament | christmas card for grandpa
IMN000362,apparel,recipient,girl,theme,boho,girl,,,,boho,,,,,,452902,550916.5,691411.5,0.0,0.0,0.0,4,1,4,6.81,declining,0,boho baby girl clothes
IMN000363,apparel,recipient,girl,interest,soccer,girl,,,soccer,,,shirt,,,,436793,607921.75,818335.5,0.0,0.0,0.0,14,7,4,6.79,declining,0,soccer shirt for girls | girls football shirt | girls soccer shirt | baby girl football clothes | toddler girl football shirt | soccer clothes for girls | girls soccer sweatshirt
IMN000364,birthday,interest,gardening,,,,,,gardening,,,,,,birthday,409553,722119.75,918308.0,0.0,0.0,0.0,6,4,2,6.76,declining,0,grow a garden roblox birthday decorations | happy birthday garden flag | garden birthday party decorations | birthday garden flag
IMN000365,christmas,interest,gardening,theme,funny,,,,gardening,funny,,,,christmas,christmas,464050,535875.25,607700.5,0.0,0.0,0.0,2,2,1,6.76,stable,0,funny christmas garden flag | christmas garden flag funny
IMN000366,apparel,recipient,dad,interest,soccer,dad,,,soccer,,,shirt,,,,429846,656343.75,844090.0,0.0,0.0,0.0,4,2,3,6.73,declining,0,soccer dad shirt | football dad shirt
IMN000367,gift,interest,pickleball,theme,funny,,,,pickleball,funny,,,,,,408554,744113.0,924684.0,0.0,0.0,0.0,4,3,2,6.72,growing,0,funny pickleball gift | pickleball funny gift | pickleball gag gift
IMN000368,unknown,recipient,wife,theme,floral,wife,,,,floral,,,,,,448316,598422.0,647412.5,0.0,0.0,0.0,8,2,4,6.71,declining,0,compassion flower mrs meyers | mrs meyers compassion flower
IMN000369,unknown,recipient,son,theme,faith,son,,,,faith,,,,,,457432,584238.0,882103.5,0.0,0.0,0.0,6,4,3,6.67,growing,0,jesus son | jesus son by denis johnson | jesus son book | bible verse jar for son
IMN000370,birthday,recipient,son,theme,funny,son,,,,funny,,,,,birthday,443224,637646.5,832069.0,0.0,0.0,0.0,2,1,2,6.65,declining,0,funny birthday card for son
IMN000371,unknown,profession,nurse,interest,coffee,,nurse,,coffee,,,mug,,,,424246,718595.5,867181.0,0.0,0.0,0.0,4,3,2,6.62,growing,0,nurse coffee mug | nurse coffee tumbler | nurse coffee cup
IMN000372,unknown,recipient,mom,interest,gardening,mom,,,gardening,,,,,,,457586,608383.25,759180.5,0.0,0.0,0.0,2,2,2,6.6,declining,0,wicker park faux mum garden spheres | mother garden kawaii
IMN000373,appreciation,recipient,girl,,,girl,,,,,,,,,,426248,732680.5,920876.0,0.0,0.0,0.0,11,7,3,6.57,growing,0,thanks giving outfit baby girl | thanks giving outfits for girls | baby shower thank you cards girl | thanks giving outfit toddler girl | baby girl thank you cards | thank you cards baby shower girl | thanks giving baby girl outfit
IMN000374,personalized,profession,nurse,,,,nurse,,,,,,,,,499818,499818.0,499818.0,0.0,0.0,0.0,1,1,1,6.57,stable,0,nurse custom for women
IMN000375,appreciation,profession,nurse,,,,nurse,,,,,,,,,477805,566898.0,788392.5,0.0,0.0,0.0,8,2,4,6.54,stable,0,nurse appreciation gift | nurse appreciation gift bulk
IMN000376,birthday,interest,coffee,,,,,,coffee,,,,,,birthday,446144,671022.0,830189.0,0.0,0.0,0.0,9,3,4,6.53,declining,0,a tini bit older birthday espresso | coffee birthday decorations | espresso martini birthday decorations
IMN000377,unknown,pet,cat,interest,gardening,,,cat,gardening,,,,,,,434355,753670.25,893171.5,0.0,0.0,0.0,16,8,4,6.44,growing,0,cat garden statue | solar cat garden statue | cat solar lights outdoor garden | cat zen garden | cat garden flag | fall cat garden flag | black cat garden flag | cat statues for garden
IMN000378,matching,profession,nurse,,,,nurse,,,,,,,,,487386,576389.25,665392.5,0.0,0.0,0.0,2,2,1,6.43,stable,0,doctor and nurse costumes for couples | nurse and patient couples costume
IMN000379,apparel,recipient,girl,interest,hunting,girl,,,hunting,,,shirt,,,,457432,685654.75,1030018.5,0.0,0.0,0.0,24,11,4,6.39,stable,0,kpop demon hunter shirt girls | kpop demon hunter clothes for girls | kpop demon hunter hoodie girls | girls hunting clothes | kpop demon hunter sweatshirt girls | kpop demon hunter girls clothes | k pop demon hunter clothes for girls | demon hunter shirt for girls | demon hunter clothes girls | demon hunter hoodie girls
IMN000380,unknown,recipient,girl,interest,fishing,girl,,,fishing,,,,,,,482256,604998.0,642530.0,0.0,0.0,0.0,5,2,4,6.39,growing,0,girls fishing pole | girl fishing pole
IMN000381,gift,recipient,girl,lifestyle,book lover,girl,,,,,book lover,,,,,512204,536228.5,560253.0,0.0,0.0,0.0,2,1,2,6.34,growing,0,gift for book lovers girls
IMN000382,apparel,profession,nurse,theme,funny,,nurse,,,funny,,shirt,,,,500756,580550.75,653686.0,0.0,0.0,0.0,4,1,4,6.3,growing,0,funny nurse shirt
IMN000383,matching,interest,yoga,,,,,,yoga,,,,,,,411473,938394.0,1048334.0,0.0,0.0,0.0,9,3,4,6.28,declining,0,alo yoga matching set | crz yoga matching set | matching yoga sets for women
IMN000384,apparel,recipient,husband,theme,funny,husband,,,,funny,,shirt,,,,443925,797868.0,958034.5,0.0,0.0,0.0,4,1,4,6.25,growing,0,funny husband shirt
IMN000385,anniversary,recipient,daughter,,,daughter,,,,,,,,,anniversary,506961,589154.25,623435.5,0.0,0.0,0.0,4,2,2,6.22,declining,0,anniversary card for daughter and son in law | anniversary card for son and daughter in law
IMN000386,birthday,recipient,husband,theme,funny,husband,,,,funny,,,,,birthday,482965,669420.25,829867.0,0.0,0.0,0.0,16,5,4,6.2,declining,0,funny birthday card for husband | husband birthday card funny | funny husband birthday card | birthday card for husband funny | funny birthday cards for husband
IMN000387,christmas,profession,police officer,,,,police officer,,,,,ornament,,christmas,christmas,511334,596699.75,641640.5,0.0,0.0,0.0,8,5,2,6.16,declining,0,police christmas ornament | police ornament for christmas tree | christmas village police station | police christmas decorations | police officer christmas ornament
IMN000388,gift,recipient,husband,interest,gaming,husband,,,gaming,,,,,,,495446,673752.0,1131651.0,0.0,0.0,0.0,5,2,2,6.08,growing,0,gift for gamer husband | gamer husband gift
IMN000389,gift,recipient,dad,theme,faith,dad,,,,faith,,,,,,495446,708230.0,1075274.0,0.0,0.0,0.0,4,3,2,5.99,growing,0,christian gift for dad | christian dad gift | religious gift for dad
IMN000390,unknown,interest,hunting,theme,american,,,,hunting,american,,,,,,501454,698888.75,880640.0,0.0,0.0,0.0,10,4,4,5.97,growing,0,outdoor pastimes of an american hunter | american hunter feeder parts | american hunter | american hunter deer feeder
IMN000391,christmas,interest,camping,,,,,,camping,,,ornament,,christmas,christmas,508569,684036.75,822880.0,0.0,0.0,0.0,10,4,2,5.95,growing,0,camping ornament for christmas tree | camping christmas ornament | camper christmas ornament | camper ornament for christmas tree
IMN000392,wedding,recipient,wife,,,wife,,,,,,,,,anniversary,509828,680558.0,701653.0,0.0,0.0,0.0,5,2,3,5.94,declining,0,wedding anniversary card for wife | mr and mrs sign for wedding table
IMN000393,apparel,pet,dog,theme,funny,,,dog,,funny,,shirt,,,,464335,874891.25,1013949.0,0.0,0.0,0.0,8,3,4,5.9,growing,0,funny dog shirt | funny dog clothes | funny dog shirt for women
IMN000394,unknown,recipient,dog mom,interest,coffee,dog mom,,,coffee,,,mug,,,,519390,672455.25,825520.5,0.0,0.0,0.0,2,1,2,5.89,growing,0,dog mom coffee mug
IMN000395,unknown,pet,cat,interest,hunting,,,cat,hunting,,,,,,,533505,637890.5,873801.0,0.0,0.0,0.0,18,8,4,5.87,stable,0,cat hunting toys for indoor cats | cat balls ghost hunting | hunter cat skimmer detector card | cat toys for hunting | cat hunting toy | cat from kpop demon hunter costume | cat hunting spiral tunnel toy | self play cat hunting spiral tunnel toy
IMN000396,apparel,interest,soccer,theme,funny,,,,soccer,funny,,shirt,,,,547740,598314.5,648889.0,0.0,0.0,0.0,2,2,1,5.87,stable,0,funny football shirt for women | funny football shirt
IMN000397,gift,recipient,mom,interest,soccer,mom,,,soccer,,,,,,,441233,1010570.0,1139145.0,0.0,0.0,0.0,5,4,3,5.86,growing,0,soccer mom gift | team mom gift football | football mom gift | soccer mom gift for women
IMN000398,decor,interest,pickleball,,,,,,pickleball,,,,,,,513700,699449.0,885198.0,0.0,0.0,0.0,3,2,2,5.86,declining,0,pickleball party decorations | pickleball decorations
IMN000399,birthday,recipient,dad,theme,funny,dad,,,,funny,,,,,birthday,499655,752151.0,817391.0,0.0,0.0,0.0,13,4,4,5.85,declining,1,funny dad birthday card | funny birthday card for dad | dad birthday card funny | funny birthday cards for dad
IMN000400,apparel,recipient,girl,theme,patriotic,girl,,,,patriotic,,shirt,,,,534658,648142.0,816471.5,0.0,0.0,0.0,6,4,2,5.83,declining,0,patriotic shirt for girls | girls patriotic shirt | girls usa shirt | girls american flag shirt
IMN000401,decor,recipient,girl,theme,vintage,girl,,,,vintage,,,,,,495011,786090.25,1135032.0,0.0,0.0,0.0,14,4,4,5.81,declining,0,vintage nursery decor girl | vintage girl nursery decor | vintage baby girl nursery decor | vintage girls room decor
IMN000402,decor,recipient,dad,,,dad,,,,,,,,,,521547,703810.5,768196.5,0.0,0.0,0.0,4,1,4,5.79,declining,2,our father prayer wall decor
IMN000403,gift,recipient,mom,interest,gardening,mom,,,gardening,,,,,,,560957,611894.0,662831.0,0.0,0.0,0.0,3,3,1,5.73,emerging,0,gardening gift for mom | mom gardening gift | garden gift for mom
IMN000404,gift,recipient,son,theme,funny,son,,,,funny,,,,,,500098,827930.5,1155763.0,0.0,0.0,0.0,3,2,2,5.68,growing,0,funny son in law gift | funny gift for son
IMN000405,personalized,recipient,mom,,,mom,,,,,,blanket,photo,,,512922,797526.0,885119.0,0.0,0.0,0.0,17,12,2,5.64,growing,3,custom blanket for mom | personalized necklace for mom | custom mama sweatshirt | custom mom sweatshirt | personalized mama sweatshirt | custom necklace for mom | personalized mom photo book | personalized mom sweatshirt | personalized blanket for mom | custom mom necklace
IMN000406,apparel,profession,truck driver,theme,patriotic,,truck driver,,,patriotic,,,,,,503393,841091.0,982887.0,0.0,0.0,0.0,5,2,4,5.63,declining,0,american flag trucker hat | usa trucker hat
IMN000407,unknown,pet,dog,theme,patriotic,,,dog,,patriotic,,,,,,527715,754093.5,985585.0,0.0,0.0,0.0,31,15,4,5.62,growing,0,dog toys made in usa only | dog treats made in usa only | dog treats made in usa | dog toys made in usa | american flag dog collar | dog jerky treats made in usa only | collagen for dogs made in usa | liver treats for dogs made in usa | chicken jerky dog treats made in usa | made in usa dog treats
IMN000408,anniversary,recipient,husband,theme,funny,husband,,,,funny,,,,,anniversary,533670,731252.25,867030.5,0.0,0.0,0.0,4,2,2,5.62,declining,0,funny anniversary cards for husband | anniversary card for husband funny
IMN000409,apparel,interest,reading,lifestyle,book lover,,,,reading,,book lover,sweatshirt,,,,523215,771828.0,913364.0,0.0,0.0,0.0,9,3,4,5.61,growing,0,book lover sweatshirt | bookworm sweatshirt | book lover shirt
IMN000410,decor,pet,cat,interest,gardening,,,cat,gardening,,,,,,,550897,691479.5,832062.0,0.0,0.0,0.0,2,1,2,5.59,growing,0,cat garden decor
IMN000411,unknown,profession,chef,interest,coffee,,chef,,coffee,,,,,,,562381,658732.0,755083.0,0.0,0.0,0.0,2,1,2,5.59,declining,0,plum chef espresso machine
IMN000412,gift,profession,firefighter,theme,funny,,firefighter,,,funny,,,,,,588691,588691.0,588691.0,0.0,0.0,0.0,1,1,1,5.59,emerging,0,funny firefighter gift
IMN000413,gift,recipient,grandma,theme,faith,grandma,,,,faith,,,,,,523215,801254.0,1079293.0,0.0,0.0,0.0,3,3,1,5.55,emerging,0,christian gift for grandma | religious gift for grandma | christian grandma gift
IMN000414,apparel,profession,truck driver,theme,faith,,truck driver,,,faith,,,,,,547740,721845.5,890206.0,0.0,0.0,0.0,7,2,4,5.54,declining,0,christian trucker hat | jesus trucker hat
IMN000415,gift,interest,hunting,theme,funny,,,,hunting,funny,,,,,,508569,886925.0,1265281.0,0.0,0.0,0.0,3,2,2,5.49,growing,0,funny hunting gift | funny hunting gift for men
IMN000416,apparel,recipient,dog mom,,,dog mom,,,,,,sweatshirt,,,,555051,717101.5,879152.0,0.0,0.0,0.0,2,1,2,5.49,growing,0,dog mama sweatshirt
IMN000417,gift,recipient,grandma,interest,gardening,grandma,,,gardening,,,,,,,587786,635204.0,682622.0,0.0,0.0,0.0,3,3,1,5.46,emerging,0,grandma garden gift | gardening gift for grandma | garden gift for grandma
IMN000418,decor,profession,police officer,,,,police officer,,,,,,,,,587627,671494.0,755361.0,0.0,0.0,0.0,3,1,3,5.37,declining,0,police party decorations
IMN000419,apparel,profession,truck driver,interest,soccer,,truck driver,,soccer,,,,,,,588898,665466.25,742034.5,0.0,0.0,0.0,2,2,1,5.37,stable,0,football trucker hat | football trucker hat women
IMN000420,appreciation,interest,soccer,,,,,,soccer,,,,,,,566707,735788.0,933236.0,0.0,0.0,0.0,5,3,3,5.36,declining,0,football thank you cards | soccer thank you cards | soccer coach thank you card
IMN000421,unknown,interest,coffee,theme,watercolor,,,,coffee,watercolor,,mug,,,,524691,900892.5,1195840.5,0.0,0.0,0.0,4,4,1,5.33,emerging,0,3d painted books coffee mug | hand painted book coffee mug | hand painted coffee mug | painted book coffee mug
IMN000422,apparel,recipient,boy,theme,faith,boy,,,,faith,,shirt,,,,556691,793723.0,1007446.0,0.0,0.0,0.0,17,7,4,5.3,growing,0,christian shirt for boys | boys christian hoodie | boys church clothes | baby boy church clothes | boys christian shirt | church clothes for boys | faith over fear hoodie boys
IMN000423,birthday,profession,police officer,,,,police officer,,,,,,,,birthday,587627,704114.0,903973.0,0.0,0.0,0.0,4,1,4,5.28,declining,0,police birthday party decorations
IMN000424,unknown,pet,cat,interest,camping,,,cat,camping,,,,,,,523215,944871.0,1160441.0,0.0,0.0,0.0,4,4,1,5.26,emerging,0,campfire fish cat toy | campfire cat toy | cat campfire treat toy | campfire cat treat dispenser
IMN000425,apparel,profession,teacher,interest,reading,,teacher,,reading,,,shirt,,,,624999,624999.0,624999.0,0.0,0.0,0.0,1,1,1,5.23,stable,0,reading teacher shirt
IMN000426,apparel,recipient,boy,theme,funny,boy,,,,funny,,shirt,,,,581271,755233.5,1178506.0,0.0,0.0,0.0,7,4,2,5.21,growing,0,funny shirt for boys | funny shirt for teen boys | funny boys shirt | funny teen boy shirt
